{
  "$schema": "http://json-schema.org/draft-07/schema#",
  "$id": "https://github.com/AdamKmet1997/HistoryMap-Data/schema.json",
  "title": "Historical Event",
  "description": "Schema for historical events in the HistoryMap database",
  "type": "object",
  "required": [
    "id",
    "title",
    "description",
    "startDate",
    "location",
    "category",
    "status",
    "sources"
  ],
  "properties": {
    "id": {
      "type": "string",
      "description": "Unique identifier for the event (use kebab-case, e.g., 'easter-rising-1916')",
      "pattern": "^[a-z0-9-]+$",
      "minLength": 3,
      "maxLength": 100
    },
    "title": {
      "type": "string",
      "description": "Title of the historical event",
      "minLength": 5,
      "maxLength": 200
    },
    "description": {
      "type": "string",
      "description": "Detailed description of the event (supports Markdown formatting)",
      "minLength": 50,
      "maxLength": 5000
    },
    "startDate": {
      "type": "string",
      "description": "Start date of the event in ISO 8601 format (YYYY-MM-DD or YYYY-MM-DDTHH:mm:ss)",
      "pattern": "^-?\\d{4}-\\d{2}-\\d{2}(T\\d{2}:\\d{2}:\\d{2})?$"
    },
    "endDate": {
      "type": "string",
      "description": "End date of the event (optional, same format as startDate)",
      "pattern": "^-?\\d{4}-\\d{2}-\\d{2}(T\\d{2}:\\d{2}:\\d{2})?$"
    },
    "location": {
      "type": "object",
      "description": "Geographic location of the event",
      "required": ["latitude", "longitude", "country"],
      "properties": {
        "latitude": {
          "type": "number",
          "description": "Latitude coordinate",
          "minimum": -90,
          "maximum": 90
        },
        "longitude": {
          "type": "number",
          "description": "Longitude coordinate",
          "minimum": -180,
          "maximum": 180
        },
        "country": {
          "type": "string",
          "description": "Country where the event took place",
          "minLength": 2,
          "maxLength": 100
        },
        "city": {
          "type": "string",
          "description": "City where the event took place (optional)",
          "maxLength": 100
        },
        "region": {
          "type": "string",
          "description": "Region/state/province where the event took place (optional)",
          "maxLength": 100
        }
      },
      "additionalProperties": false
    },
    "category": {
      "type": "string",
      "description": "Category of the historical event",
      "enum": [
        "politics",
        "war",
        "culture",
        "science",
        "disaster",
        "religion",
        "exploration"
      ]
    },
    "status": {
      "type": "string",
      "description": "Approval status of the event",
      "enum": ["pending", "approved", "rejected"],
      "default": "approved"
    },
    "sources": {
      "type": "array",
      "description": "List of source URLs for verification",
      "minItems": 1,
      "maxItems": 10,
      "items": {
        "type": "string",
        "format": "uri",
        "pattern": "^https?://"
      }
    },
    "createdAt": {
      "type": "string",
      "description": "Timestamp when this event was added to the database",
      "pattern": "^\\d{4}-\\d{2}-\\d{2}(T\\d{2}:\\d{2}:\\d{2})?$"
    },
    "updatedAt": {
      "type": "string",
      "description": "Timestamp when this event was last updated",
      "pattern": "^\\d{4}-\\d{2}-\\d{2}(T\\d{2}:\\d{2}:\\d{2})?$"
    }
  },
  "additionalProperties": false
}
