{
  "id": "66",
  "title": "Galileo's Trial",
  "description": "In 1633, **Galileo Galilei** was tried by the Roman Inquisition for supporting heliocentrism - the idea that Earth orbits the Sun.\n\nHe was found guilty of heresy and spent the rest of his life under house arrest. Despite this, his scientific work laid the foundation for modern physics and astronomy.\n\nThe Catholic Church formally acknowledged its error in 1992.",
  "startDate": "1633-06-22",
  "location": {
    "latitude": 41.9028,
    "longitude": 12.4964,
    "country": "Italy",
    "city": "Rome"
  },
  "category": "science",
  "status": "approved",
  "sources": [
    "https://en.wikipedia.org/wiki/Galileo_affair"
  ],
  "createdAt": "2024-01-15",
  "updatedAt": "2024-01-15"
}