{
  "id": "126",
  "title": "Suez Crisis",
  "description": "The **Suez Crisis** in 1956 erupted when Egypt nationalized the Suez Canal, leading to an invasion by Britain, France, and Israel.\n\nPressure from the US and Soviet Union forced the invaders to withdraw. The crisis marked the end of Britain and France as major global powers.\n\nIt demonstrated the shift of power to the US and USSR during the Cold War.",
  "startDate": "1956-10-29",
  "location": {
    "latitude": 30.0444,
    "longitude": 31.2357,
    "country": "Egypt",
    "city": "Cairo"
  },
  "category": "war",
  "status": "approved",
  "sources": [
    "https://en.wikipedia.org/wiki/Suez_Crisis"
  ],
  "createdAt": "2024-01-16",
  "updatedAt": "2024-01-16"
}