{
  "id": "dissolution-of-the-soviet-union",
  "title": "Dissolution of the Soviet Union",
  "description": "The **Soviet Union** officially dissolved on December 26, 1991, ending 69 years of communist rule and marking the end of the Cold War.\n\nFifteen independent republics emerged from the USSR. Mikhail Gorbachev resigned as Soviet President on December 25.\n\nThe dissolution fundamentally changed global politics and ended the bipolar world order.",
  "startDate": "1991-12-26",
  "location": {
    "latitude": 55.7558,
    "longitude": 37.6173,
    "country": "Russia",
    "city": "Moscow"
  },
  "category": "politics",
  "status": "approved",
  "sources": [
    "https://en.wikipedia.org/wiki/Dissolution_of_the_Soviet_Union"
  ],
  "createdAt": "2024-01-16",
  "updatedAt": "2024-01-16"
}
