{
  "id": "128",
  "title": "Nelson Mandela Released from Prison",
  "description": "**Nelson Mandela** was released from prison on February 11, 1990, after 27 years of imprisonment for fighting apartheid in South Africa.\n\nHis release marked the beginning of the end of apartheid. Mandela led negotiations for a peaceful transition to democracy.\n\nHe became South Africa's first Black president in 1994.",
  "startDate": "1990-02-11",
  "location": {
    "latitude": -33.9249,
    "longitude": 18.4241,
    "country": "South Africa",
    "city": "Cape Town"
  },
  "category": "politics",
  "status": "approved",
  "sources": [
    "https://en.wikipedia.org/wiki/Nelson_Mandela"
  ],
  "createdAt": "2024-01-16",
  "updatedAt": "2024-01-16"
}