{
  "id": "92",
  "title": "D-Day - Normandy Landings",
  "description": "On June 6, 1944, Allied forces launched **Operation Overlord**, the largest seaborne invasion in history, landing on the beaches of Normandy, France.\n\nOver 150,000 troops stormed five beaches, suffering heavy casualties but establishing a crucial foothold in Nazi-occupied Europe.\n\nD-Day marked the beginning of the liberation of Western Europe from Nazi control.",
  "startDate": "1944-06-06",
  "location": {
    "latitude": 49.3428,
    "longitude": -0.5156,
    "country": "France",
    "city": "Normandy"
  },
  "category": "war",
  "status": "approved",
  "sources": [
    "https://en.wikipedia.org/wiki/Normandy_landings"
  ],
  "createdAt": "2024-01-15",
  "updatedAt": "2024-01-15"
}