{
  "id": "battle-of-the-boyne",
  "title": "Battle of the Boyne",
  "description": "The **Battle of the Boyne** was fought on July 1, 1690 (July 12 in the modern calendar), between the forces of the deposed King James II and those of King William III near the town of Drogheda on the east coast of Ireland.\n\nWilliam's forces, composed of Dutch, English, Scottish, French Huguenot, and Danish troops, defeated James's army of Irish Catholics and French troops. The battle was a key moment in the Williamite War in Ireland.\n\nThe battle has remained a significant symbolic event in Irish history, particularly for Protestant communities in Northern Ireland, who commemorate it annually on July 12. It remains a politically sensitive topic due to its association with sectarian divisions.",
  "startDate": "1690-07-01",
  "location": {
    "latitude": 53.7167,
    "longitude": -6.3611,
    "country": "Ireland",
    "city": "Drogheda"
  },
  "category": "war",
  "status": "approved",
  "sources": [
    "https://en.wikipedia.org/wiki/Battle_of_the_Boyne",
    "https://www.historyireland.com/early-modern-history-1500-1700/the-battle-of-the-boyne-1690/"
  ],
  "createdAt": "2024-01-31",
  "updatedAt": "2024-01-31"
}
