{
  "id": "woodstock-festival",
  "title": "Woodstock Festival",
  "description": "The **Woodstock Music Festival** in August 1969 attracted 400,000 people to a farm in New York, becoming an icon of the 1960s counterculture.\n\nDespite rain, mud, and overcrowding, the festival featured legendary performances by Jimi Hendrix, Janis Joplin, The Who, and many others.\n\nWoodstock symbolized the peace and music movement of the era.",
  "startDate": "1969-08-15",
  "endDate": "1969-08-18",
  "location": {
    "latitude": 41.7012,
    "longitude": -74.3649,
    "country": "United States",
    "city": "Bethel",
    "region": "New York"
  },
  "category": "culture",
  "status": "approved",
  "sources": [
    "https://en.wikipedia.org/wiki/Woodstock"
  ],
  "createdAt": "2024-01-16",
  "updatedAt": "2024-01-16"
}
