{
  "id": "84",
  "title": "Assassination of Archduke Franz Ferdinand",
  "description": "**Archduke Franz Ferdinand** of Austria and his wife were assassinated in Sarajevo on June 28, 1914, by Gavrilo Princip, a Bosnian Serb nationalist.\n\nThis event triggered a chain of events that led to World War I. Austria-Hungary declared war on Serbia, setting off a cascade of alliances.\n\nThe war would last four years and claim over 17 million lives.",
  "startDate": "1914-06-28",
  "location": {
    "latitude": 43.8563,
    "longitude": 18.4131,
    "country": "Bosnia and Herzegovina",
    "city": "Sarajevo"
  },
  "category": "war",
  "status": "approved",
  "sources": [
    "https://en.wikipedia.org/wiki/Assassination_of_Archduke_Franz_Ferdinand"
  ],
  "createdAt": "2024-01-15",
  "updatedAt": "2024-01-15"
}